{
  "schema_version": "o2.candidate.v1",
  "maturity": "researched",
  "contract_frozen": false,
  "synthetic": true,
  "ordering": "accepted_at_then_raw_record_id",
  "visibility_rule": "accepted_at_lte_decision_time_excluding_duplicates",
  "checks": [
    {
      "check_id": "late_correction_before_amendment",
      "decision_time": "2024-04-01T00:00:00Z",
      "natural_key": "sec:fact:0000000001:revenue:fy2023",
      "visible_raw_record_ids": ["raw-eq-10k"],
      "hidden_raw_record_ids": ["raw-eq-10k-dup", "raw-eq-10ka"],
      "effective_raw_record_id": "raw-eq-10k"
    },
    {
      "check_id": "duplicate_does_not_supersede",
      "decision_time": "2024-03-02T00:00:00Z",
      "natural_key": "sec:fact:0000000001:revenue:fy2023",
      "visible_raw_record_ids": ["raw-eq-10k"],
      "hidden_raw_record_ids": ["raw-eq-10k-dup", "raw-eq-10ka"],
      "effective_raw_record_id": "raw-eq-10k"
    },
    {
      "check_id": "late_correction_after_amendment",
      "decision_time": "2024-07-01T00:00:00Z",
      "natural_key": "sec:fact:0000000001:revenue:fy2023",
      "visible_raw_record_ids": ["raw-eq-10k", "raw-eq-10ka"],
      "hidden_raw_record_ids": ["raw-eq-10k-dup"],
      "effective_raw_record_id": "raw-eq-10ka"
    },
    {
      "check_id": "out_of_order_acceptance_hidden",
      "decision_time": "2024-04-01T00:00:00Z",
      "natural_key": "sec:accession:0000000001-24-000050",
      "visible_raw_record_ids": [],
      "hidden_raw_record_ids": ["raw-eq-ooo"],
      "effective_raw_record_id": null
    },
    {
      "check_id": "out_of_order_acceptance_visible_after_accept",
      "decision_time": "2024-05-02T00:00:00Z",
      "natural_key": "sec:accession:0000000001-24-000050",
      "visible_raw_record_ids": ["raw-eq-ooo"],
      "hidden_raw_record_ids": [],
      "effective_raw_record_id": "raw-eq-ooo"
    },
    {
      "check_id": "corporate_action_retained",
      "decision_time": "2024-08-02T00:00:00Z",
      "natural_key": "us-equity:listing:0000000001:common:corporate_action",
      "visible_raw_record_ids": ["raw-eq-split"],
      "hidden_raw_record_ids": [],
      "effective_raw_record_id": "raw-eq-split"
    },
    {
      "check_id": "unadjusted_quote_not_rewritten",
      "decision_time": "2024-08-02T00:00:00Z",
      "natural_key": "us-equity:listing:0000000001:common:quote",
      "visible_raw_record_ids": ["raw-eq-quote"],
      "hidden_raw_record_ids": [],
      "effective_raw_record_id": "raw-eq-quote"
    },
    {
      "check_id": "event_resolution_before_late_message",
      "decision_time": "2024-08-21T00:00:00Z",
      "natural_key": "kalshi_demo:market:kxsynth-26jan01-b1:resolution",
      "visible_raw_record_ids": ["raw-ev-determined"],
      "hidden_raw_record_ids": ["raw-ev-settled"],
      "effective_raw_record_id": "raw-ev-determined"
    },
    {
      "check_id": "event_close_out_of_order_hidden",
      "decision_time": "2024-08-21T00:00:00Z",
      "natural_key": "kalshi_demo:market:kxsynth-26jan01-b1:close_date",
      "visible_raw_record_ids": [],
      "hidden_raw_record_ids": ["raw-ev-close-ooo"],
      "effective_raw_record_id": null
    },
    {
      "check_id": "event_close_visible_only_after_accept",
      "decision_time": "2024-08-26T00:00:00Z",
      "natural_key": "kalshi_demo:market:kxsynth-26jan01-b1:close_date",
      "visible_raw_record_ids": ["raw-ev-close-ooo"],
      "hidden_raw_record_ids": [],
      "effective_raw_record_id": "raw-ev-close-ooo"
    },
    {
      "check_id": "event_settled_keeps_determination_raw",
      "decision_time": "2024-09-02T00:00:00Z",
      "natural_key": "kalshi_demo:market:kxsynth-26jan01-b1:resolution",
      "visible_raw_record_ids": ["raw-ev-determined", "raw-ev-settled"],
      "hidden_raw_record_ids": [],
      "effective_raw_record_id": "raw-ev-settled"
    },
    {
      "check_id": "voided_event_stays_distinct",
      "decision_time": "2024-09-02T00:00:00Z",
      "natural_key": "kalshi_demo:market:kxsynth-26jan01-void:resolution",
      "visible_raw_record_ids": ["raw-ev-void"],
      "hidden_raw_record_ids": [],
      "effective_raw_record_id": "raw-ev-void"
    }
  ]
}
